### ISSUE TITLE
[Bug]: [RDV] Server possibly sending back NEX Packets instead of RDV Packets In Quazal for Initial Handshake (SYN)

### ISSUE THREAD

**Issue by GuestDreemurr** [PretendoNetwork/nex-go#101]
### Checked Existing

- [x] I have checked the repository for duplicate issues.

### What happened?

I am trying to reimplement the Uplay Wii U app's RDV server and nex-go is for some reason sending NEX packets instead of RDV packets for SYN? even if it is in quazal mode.

I am not entirely confident in my ability to understand these packets so i could be wrong

one packet from my wii u to my server:
```
03:57:00.608316 wlan0 In  IP Nintendo\032Wii\032U.lan.xadmin > archlinux.22250: UDP, length 18
        0x0000:  0800 0000 0000 0003 0001 0006 34af 2c9d  ............4.,.
        0x0010:  61de 0000 4500 002e 0b6c 0000 4011 99f6  a...E....l..@...
        0x0020:  0a13 608b 0a13 60ac 2391 56ea 001a 507e  ..`...`.#.V...P~
        0x0030:  3f31 2000 0000 0000 0000 0000 0000 e031  ?1.............1
        0x0040:  2000     
```

one packet from my server to my wii u:
```
03:57:00.608797 wlan0 Out IP archlinux.22250 > Nintendo\032Wii\032U.lan.xadmin: UDP, length 17
        0x0000:  0800 0000 0000 0003 0001 0406 f4a4 759b  ..............u.
        0x0010:  ccd3 0000 4500 002d 5fb2 4000 4011 05b2  ....E..-_.@.@...
        0x0020:  0a13 60ab 0a13 608b 56ea 2391 0019 d586  ..`...`.V.#.....
        0x0030:  313f 4800 0000 0000 0000 0000 0000 0000  1?H.............
        0x0040:  00    
```

code:
```
package main

import (
	"fmt"
	"github.com/PretendoNetwork/nex-go/v2"
	"github.com/PretendoNetwork/nex-go/v2/types"
)

func main() {
	authServer := nex.NewPRUDPServer() // The main PRUDP server
	endpoint := nex.NewPRUDPEndPoint(1) // A PRUDP endpoint for PRUDP connections to connect to. Bound to StreamID 1
	endpoint.ServerAccount = nex.NewAccount(types.NewPID(1), "Quazal Authentication", "password", false)
	//endpoint.AccountDetailsByPID = accountDetailsByPID
	//endpoint.AccountDetailsByUsername = accountDetailsByUsername

	// Setup event handlers for the endpoint
	endpoint.OnError(func(err *nex.Error) {
		fmt.Printf("err: %v", err)
	})


	endpoint.OnData(func(packet nex.PacketInterface) {
		if packet, ok := packet.(nex.PRUDPPacketInterface); ok {
			request := packet.RMCMessage()

			fmt.Println("[AUTH]", request.ProtocolID, request.MethodID, request.ProtocolName)
		}
	})

	// Bind the endpoint to the server and configure it's settings
	authServer.BindPRUDPEndPoint(endpoint)
	authServer.SetFragmentSize(962)
	authServer.LibraryVersions.SetDefault(nex.NewLibraryVersion(1, 1, 0)) // unsure what to put here for a RDV server..
	authServer.SessionKeyLength = 16
	authServer.AccessKey = "12345678" // cannot get past SYN and i am yet to find a access key in the executable.
	authServer.PRUDPV0Settings.IsQuazalMode = true

	fmt.Println("Uplay RDV running at port 22250.")
	authServer.Listen(22250)
}
```

### What did you expect to happen?

for SYN not to fail i suppose? this is my first time touching anything RDV related.

### Steps to reproduce?

1. Redirect Uplay Wii U app via DNS to my own Uplay RDV server (which is given to the client via a json api on onlineconfigservice.ubi.com that i have also reimplemented)
2. run provided file as the server.

**Comment by jonbarrow** [comment]
You've listed these packets as just "one packet" from either end, but it would be helpful to know at what stage these packets were actually sent at (or even to get an actual dump, you can submit them to us privately via the Discord server bot). Because the samples you gave don't make a lot of sense given the current context

The packet from the client is `3f31200000000000000000000000e0312000`, which when read as a Quazal-mode packet is:
- Source virtual port `0x3f` (stream ID 15, stream type 3)
- Destination virtual port `0x31` (stream ID 1, stream type 3)
- "Type and flags" `0x20` (flags 4, type 0)
- Session ID `0x00`
- Packet signature `0x00000000`
- Sequence ID `0x0000`
- Connection signature `0x00000000`
- Checksum `0xe0312000`

This all looks fine. The packet from the server, however, is `313f480000000000000000000000000000`, which when read as a Quazal-mode packet is:
- Source virtual port `0x31` (stream ID 1, stream type 3)
- Destination virtual port `0x3f` (stream ID 15, stream type 3)
- "Type and flags" `0x48` (flags 4, type 8)
- And then the rest is null

The reason I'm asking where in the process these packets are coming from is because the packet from the server is not a `SYN` packet at all. It is a `DATA` packet with the flag `NEED_ACK`, which indicates to me that the connection is being established correctly and now `DATA` packets are being sent (which is only possible *after* the `SYN`/`CONNECT` process)

Are you using a fork of our libraries? The fact that the rest of the packet is all null bytes does seem strange, that shouldn't happen. The `IsQuazalMode` setting doesn't change any actual behavior of any libraries outside of the way the packet flags/type is encoded in specifically PRUDPv0 packets (which, to be honest, this setting should probably be removed and replaced with something more robust I think, @DaniElectra?)

Outside of that, the only obvious thing that jumps out at me is the fact that the client you're using is configured to use "enhanced checksums" (as indicated by the 4 byte checksum), but you didn't enable this in the settings

**Comment by GuestDreemurr** [comment]
no, i am using latest available nex-go.


packets with enhanced checksum disabled
```
18:02:57.096646 wlan0 In  IP Nintendo\032Wii\032U.lan.xadmin > archlinux.22250: UDP, length 18
        0x0000:  0800 0000 0000 0003 0001 0006 34af 2c9d  ............4.,.
        0x0010:  61de 0000 4500 002e 0667 0000 4011 9efc  a...E....g..@...
        0x0020:  0a13 608b 0a13 60ab 2391 56ea 001a 507f  ..`...`.#.V...P.
        0x0030:  3f31 2000 0000 0000 0000 0000 0000 e031  ?1.............1
        0x0040:  2000                                     ..
18:02:57.096910 wlan0 Out IP archlinux.22250 > Nintendo\032Wii\032U.lan.xadmin: UDP, length 17
        0x0000:  0800 0000 0000 0003 0001 0406 f4a4 759b  ..............u.
        0x0010:  ccd3 0000 4500 002d 29cc 4000 4011 3b98  ....E..-).@.@.;.
        0x0020:  0a13 60ab 0a13 608b 56ea 2391 0019 d586  ..`...`.V.#.....
        0x0030:  313f 4800 0000 0000 0000 0000 0000 0000  1?H.............
        0x0040:  00                                       .
18:02:57.112358 wlan0 In  IP Nintendo\032Wii\032U.lan.xadmin > archlinux.22250: UDP, length 18
        0x0000:  0800 0000 0000 0003 0001 0006 34af 2c9d  ............4.,.
        0x0010:  61de 0000 4500 002e 0668 0000 4011 9efb  a...E....h..@...
        0x0020:  0a13 608b 0a13 60ab 2391 56ea 001a 527f  ..`...`.#.V...R.
        0x0030:  3e31 2000 0000 0000 0000 0000 0000 df31  >1.............1
        0x0040:  2000                                     ..
18:02:57.112595 wlan0 Out IP archlinux.22250 > Nintendo\032Wii\032U.lan.xadmin: UDP, length 17
        0x0000:  0800 0000 0000 0003 0001 0406 f4a4 759b  ..............u.
        0x0010:  ccd3 0000 4500 002d 29d9 4000 4011 3b8b  ....E..-).@.@.;.
        0x0020:  0a13 60ab 0a13 608b 56ea 2391 0019 d586  ..`...`.V.#.....
        0x0030:  313e 4800 0000 0000 0000 0000 0000 0000  1>H.............
        0x0040:  00                                       .
18:02:57.427944 wlan0 In  IP Nintendo\032Wii\032U.lan.xadmin > archlinux.22250: UDP, length 18
        0x0000:  0800 0000 0000 0003 0001 0006 34af 2c9d  ............4.,.
        0x0010:  61de 0000 4500 002e 0669 0000 4011 9efa  a...E....i..@...
        0x0020:  0a13 608b 0a13 60ab 2391 56ea 001a 507f  ..`...`.#.V...P.
        0x0030:  3f31 2000 0000 0000 0000 0000 0000 e031  ?1.............1
        0x0040:  2000                                     ..
18:02:57.428160 wlan0 Out IP archlinux.22250 > Nintendo\032Wii\032U.lan.xadmin: UDP, length 17
        0x0000:  0800 0000 0000 0003 0001 0406 f4a4 759b  ..............u.
        0x0010:  ccd3 0000 4500 002d 2a23 4000 4011 3b41  ....E..-*#@.@.;A
        0x0020:  0a13 60ab 0a13 608b 56ea 2391 0019 d586  ..`...`.V.#.....
        0x0030:  313f 4800 0000 0000 0000 0000 0000 0000  1?H.............
        0x0040:  00                                       .
18:02:57.443741 wlan0 In  IP Nintendo\032Wii\032U.lan.xadmin > archlinux.22250: UDP, length 18
        0x0000:  0800 0000 0000 0003 0001 0006 34af 2c9d  ............4.,.
        0x0010:  61de 0000 4500 002e 066a 0000 4011 9ef9  a...E....j..@...
        0x0020:  0a13 608b 0a13 60ab 2391 56ea 001a 527f  ..`...`.#.V...R.
        0x0030:  3e31 2000 0000 0000 0000 0000 0000 df31  >1.............1
        0x0040:  2000                                     ..
18:02:57.444061 wlan0 Out IP archlinux.22250 > Nintendo\032Wii\032U.lan.xadmin: UDP, length 17
        0x0000:  0800 0000 0000 0003 0001 0406 f4a4 759b  ..............u.
        0x0010:  ccd3 0000 4500 002d 2a30 4000 4011 3b34  ....E..-*0@.@.;4
        0x0020:  0a13 60ab 0a13 608b 56ea 2391 0019 d586  ..`...`.V.#.....
        0x0030:  313e 4800 0000 0000 0000 0000 0000 0000  1>H.............
        0x0040:  00                                       .
18:02:58.060773 wlan0 In  IP Nintendo\032Wii\032U.lan.xadmin > archlinux.22250: UDP, length 18
        0x0000:  0800 0000 0000 0003 0001 0006 34af 2c9d  ............4.,.
        0x0010:  61de 0000 4500 002e 066b 0000 4011 9ef8  a...E....k..@...
        0x0020:  0a13 608b 0a13 60ab 2391 56ea 001a 507f  ..`...`.#.V...P.
        0x0030:  3f31 2000 0000 0000 0000 0000 0000 e031  ?1.............1
        0x0040:  2000                                     ..
18:02:58.060953 wlan0 Out IP archlinux.22250 > Nintendo\032Wii\032U.lan.xadmin: UDP, length 17
        0x0000:  0800 0000 0000 0003 0001 0406 f4a4 759b  ..............u.
        0x0010:  ccd3 0000 4500 002d 2c29 4000 4011 393b  ....E..-,)@.@.9;
        0x0020:  0a13 60ab 0a13 608b 56ea 2391 0019 d586  ..`...`.V.#.....
        0x0030:  313f 4800 0000 0000 0000 0000 0000 0000  1?H.............
        0x0040:  00                                       .
18:02:58.077242 wlan0 In  IP Nintendo\032Wii\032U.lan.xadmin > archlinux.22250: UDP, length 18
        0x0000:  0800 0000 0000 0003 0001 0006 34af 2c9d  ............4.,.
        0x0010:  61de 0000 4500 002e 066c 0000 4011 9ef7  a...E....l..@...
        0x0020:  0a13 608b 0a13 60ab 2391 56ea 001a 527f  ..`...`.#.V...R.
        0x0030:  3e31 2000 0000 0000 0000 0000 0000 df31  >1.............1
        0x0040:  2000                                     ..
18:02:58.077483 wlan0 Out IP archlinux.22250 > Nintendo\032Wii\032U.lan.xadmin: UDP, length 17
        0x0000:  0800 0000 0000 0003 0001 0406 f4a4 759b  ..............u.
        0x0010:  ccd3 0000 4500 002d 2c31 4000 4011 3933  ....E..-,1@.@.93
        0x0020:  0a13 60ab 0a13 608b 56ea 2391 0019 d586  ..`...`.V.#.....
        0x0030:  313e 4800 0000 0000 0000 0000 0000 0000  1>H.............
        0x0040:  00                                       .
18:02:59.079496 wlan0 In  IP Nintendo\032Wii\032U.lan.xadmin > archlinux.22250: UDP, length 18
        0x0000:  0800 0000 0000 0003 0001 0006 34af 2c9d  ............4.,.
        0x0010:  61de 0000 4500 002e 066d 0000 4011 9ef6  a...E....m..@...
        0x0020:  0a13 608b 0a13 60ab 2391 56ea 001a 507f  ..`...`.#.V...P.
        0x0030:  3f31 2000 0000 0000 0000 0000 0000 e031  ?1.............1
        0x0040:  2000                                     ..
18:02:59.079718 wlan0 Out IP archlinux.22250 > Nintendo\032Wii\032U.lan.xadmin: UDP, length 17
        0x0000:  0800 0000 0000 0003 0001 0406 f4a4 759b  ..............u.
        0x0010:  ccd3 0000 4500 002d 3010 4000 4011 3554  ....E..-0.@.@.5T
        0x0020:  0a13 60ab 0a13 608b 56ea 2391 0019 d586  ..`...`.V.#.....
        0x0030:  313f 4800 0000 0000 0000 0000 0000 0000  1?H.............
        0x0040:  00                                       .
18:02:59.079993 wlan0 In  IP Nintendo\032Wii\032U.lan.xadmin > archlinux.22250: UDP, length 18
        0x0000:  0800 0000 0000 0003 0001 0006 34af 2c9d  ............4.,.
        0x0010:  61de 0000 4500 002e 066e 0000 4011 9ef5  a...E....n..@...
        0x0020:  0a13 608b 0a13 60ab 2391 56ea 001a 527f  ..`...`.#.V...R.
        0x0030:  3e31 2000 0000 0000 0000 0000 0000 df31  >1.............1
        0x0040:  2000                                     ..
18:02:59.080112 wlan0 Out IP archlinux.22250 > Nintendo\032Wii\032U.lan.xadmin: UDP, length 17
        0x0000:  0800 0000 0000 0003 0001 0406 f4a4 759b  ..............u.
        0x0010:  ccd3 0000 4500 002d 3011 4000 4011 3553  ....E..-0.@.@.5S
        0x0020:  0a13 60ab 0a13 608b 56ea 2391 0019 d586  ..`...`.V.#.....
        0x0030:  313e 4800 0000 0000 0000 0000 0000 0000  1>H.............
        0x0040:  00                                       .
18:03:00.296660 wlan0 In  IP Nintendo\032Wii\032U.lan.xadmin > archlinux.22250: UDP, length 18
        0x0000:  0800 0000 0000 0003 0001 0006 34af 2c9d  ............4.,.
        0x0010:  61de 0000 4500 002e 066f 0000 4011 9ef4  a...E....o..@...
        0x0020:  0a13 608b 0a13 60ab 2391 56ea 001a 507f  ..`...`.#.V...P.
        0x0030:  3f31 2000 0000 0000 0000 0000 0000 e031  ?1.............1
        0x0040:  2000                                     ..
18:03:00.296992 wlan0 Out IP archlinux.22250 > Nintendo\032Wii\032U.lan.xadmin: UDP, length 17
        0x0000:  0800 0000 0000 0003 0001 0406 f4a4 759b  ..............u.
        0x0010:  ccd3 0000 4500 002d 3182 4000 4011 33e2  ....E..-1.@.@.3.
        0x0020:  0a13 60ab 0a13 608b 56ea 2391 0019 d586  ..`...`.V.#.....
        0x0030:  313f 4800 0000 0000 0000 0000 0000 0000  1?H.............
        0x0040:  00                                       .
18:03:00.313093 wlan0 In  IP Nintendo\032Wii\032U.lan.xadmin > archlinux.22250: UDP, length 18
        0x0000:  0800 0000 0000 0003 0001 0006 34af 2c9d  ............4.,.
        0x0010:  61de 0000 4500 002e 0670 0000 4011 9ef3  a...E....p..@...
        0x0020:  0a13 608b 0a13 60ab 2391 56ea 001a 527f  ..`...`.#.V...R.
        0x0030:  3e31 2000 0000 0000 0000 0000 0000 df31  >1.............1
        0x0040:  2000                                     ..
18:03:00.313340 wlan0 Out IP archlinux.22250 > Nintendo\032Wii\032U.lan.xadmin: UDP, length 17
        0x0000:  0800 0000 0000 0003 0001 0406 f4a4 759b  ..............u.
        0x0010:  ccd3 0000 4500 002d 3183 4000 4011 33e1  ....E..-1.@.@.3.
        0x0020:  0a13 60ab 0a13 608b 56ea 2391 0019 d586  ..`...`.V.#.....
        0x0030:  313e 4800 0000 0000 0000 0000 0000 0000  1>H.............
        0x0040:  00                                       .
18:03:01.865117 wlan0 In  IP Nintendo\032Wii\032U.lan.xadmin > archlinux.22250: UDP, length 18
        0x0000:  0800 0000 0000 0003 0001 0006 34af 2c9d  ............4.,.
        0x0010:  61de 0000 4500 002e 0671 0000 4011 9ef2  a...E....q..@...
        0x0020:  0a13 608b 0a13 60ab 2391 56ea 001a 507f  ..`...`.#.V...P.
        0x0030:  3f31 2000 0000 0000 0000 0000 0000 e031  ?1.............1
        0x0040:  2000                                     ..
18:03:01.865409 wlan0 Out IP archlinux.22250 > Nintendo\032Wii\032U.lan.xadmin: UDP, length 17
        0x0000:  0800 0000 0000 0003 0001 0406 f4a4 759b  ..............u.
        0x0010:  ccd3 0000 4500 002d 3670 4000 4011 2ef4  ....E..-6p@.@...
        0x0020:  0a13 60ab 0a13 608b 56ea 2391 0019 d586  ..`...`.V.#.....
        0x0030:  313f 4800 0000 0000 0000 0000 0000 0000  1?H.............
        0x0040:  00                                       .
18:03:01.881698 wlan0 In  IP Nintendo\032Wii\032U.lan.xadmin > archlinux.22250: UDP, length 18
        0x0000:  0800 0000 0000 0003 0001 0006 34af 2c9d  ............4.,.
        0x0010:  61de 0000 4500 002e 0672 0000 4011 9ef1  a...E....r..@...
        0x0020:  0a13 608b 0a13 60ab 2391 56ea 001a 527f  ..`...`.#.V...R.
        0x0030:  3e31 2000 0000 0000 0000 0000 0000 df31  >1.............1
        0x0040:  2000                                     ..
18:03:01.881913 wlan0 Out IP archlinux.22250 > Nintendo\032Wii\032U.lan.xadmin: UDP, length 17
        0x0000:  0800 0000 0000 0003 0001 0406 f4a4 759b  ..............u.
        0x0010:  ccd3 0000 4500 002d 3674 4000 4011 2ef0  ....E..-6t@.@...
        0x0020:  0a13 60ab 0a13 608b 56ea 2391 0019 d586  ..`...`.V.#.....
        0x0030:  313e 4800 0000 0000 0000 0000 0000 0000  1>H.............
        0x0040:  00                                       .
18:03:03.783994 wlan0 In  IP Nintendo\032Wii\032U.lan.xadmin > archlinux.22250: UDP, length 18
        0x0000:  0800 0000 0000 0003 0001 0006 34af 2c9d  ............4.,.
        0x0010:  61de 0000 4500 002e 0673 0000 4011 9ef0  a...E....s..@...
        0x0020:  0a13 608b 0a13 60ab 2391 56ea 001a 507f  ..`...`.#.V...P.
        0x0030:  3f31 2000 0000 0000 0000 0000 0000 e031  ?1.............1
        0x0040:  2000                                     ..
18:03:03.784318 wlan0 Out IP archlinux.22250 > Nintendo\032Wii\032U.lan.xadmin: UDP, length 17
        0x0000:  0800 0000 0000 0003 0001 0406 f4a4 759b  ..............u.
        0x0010:  ccd3 0000 4500 002d 3745 4000 4011 2e1f  ....E..-7E@.@...
        0x0020:  0a13 60ab 0a13 608b 56ea 2391 0019 d586  ..`...`.V.#.....
        0x0030:  313f 4800 0000 0000 0000 0000 0000 0000  1?H.............
        0x0040:  00                                       .
18:03:03.786588 wlan0 In  IP Nintendo\032Wii\032U.lan.xadmin > archlinux.22250: UDP, length 18
        0x0000:  0800 0000 0000 0003 0001 0006 34af 2c9d  ............4.,.
        0x0010:  61de 0000 4500 002e 0674 0000 4011 9eef  a...E....t..@...
        0x0020:  0a13 608b 0a13 60ab 2391 56ea 001a 527f  ..`...`.#.V...R.
        0x0030:  3e31 2000 0000 0000 0000 0000 0000 df31  >1.............1
        0x0040:  2000                                     ..
18:03:03.786801 wlan0 Out IP archlinux.22250 > Nintendo\032Wii\032U.lan.xadmin: UDP, length 17
        0x0000:  0800 0000 0000 0003 0001 0406 f4a4 759b  ..............u.
        0x0010:  ccd3 0000 4500 002d 3746 4000 4011 2e1e  ....E..-7F@.@...
        0x0020:  0a13 60ab 0a13 608b 56ea 2391 0019 d586  ..`...`.V.#.....
        0x0030:  313e 4800 0000 0000 0000 0000 0000 0000  1>H.............
        0x0040:  00                                       .
18:03:06.036802 wlan0 In  IP Nintendo\032Wii\032U.lan.xadmin > archlinux.22250: UDP, length 18
        0x0000:  0800 0000 0000 0003 0001 0006 34af 2c9d  ............4.,.
        0x0010:  61de 0000 4500 002e 0675 0000 4011 9eee  a...E....u..@...
        0x0020:  0a13 608b 0a13 60ab 2391 56ea 001a 507f  ..`...`.#.V...P.
        0x0030:  3f31 2000 0000 0000 0000 0000 0000 e031  ?1.............1
        0x0040:  2000                                     ..
18:03:06.036848 wlan0 In  IP Nintendo\032Wii\032U.lan.xadmin > archlinux.22250: UDP, length 18
        0x0000:  0800 0000 0000 0003 0001 0006 34af 2c9d  ............4.,.
        0x0010:  61de 0000 4500 002e 0676 0000 4011 9eed  a...E....v..@...
        0x0020:  0a13 608b 0a13 60ab 2391 56ea 001a 527f  ..`...`.#.V...R.
        0x0030:  3e31 2000 0000 0000 0000 0000 0000 df31  >1.............1
        0x0040:  2000                                     ..
18:03:06.037127 wlan0 Out IP archlinux.22250 > Nintendo\032Wii\032U.lan.xadmin: UDP, length 17
        0x0000:  0800 0000 0000 0003 0001 0406 f4a4 759b  ..............u.
        0x0010:  ccd3 0000 4500 002d 3ae6 4000 4011 2a7e  ....E..-:.@.@.*~
        0x0020:  0a13 60ab 0a13 608b 56ea 2391 0019 d586  ..`...`.V.#.....
        0x0030:  313e 4800 0000 0000 0000 0000 0000 0000  1>H.............
        0x0040:  00                                       .
18:03:06.037201 wlan0 Out IP archlinux.22250 > Nintendo\032Wii\032U.lan.xadmin: UDP, length 17
        0x0000:  0800 0000 0000 0003 0001 0406 f4a4 759b  ..............u.
        0x0010:  ccd3 0000 4500 002d 3ae7 4000 4011 2a7d  ....E..-:.@.@.*}
        0x0020:  0a13 60ab 0a13 608b 56ea 2391 0019 d586  ..`...`.V.#.....
        0x0030:  313f 4800 0000 0000 0000 0000 0000 0000  1?H.............
        0x0040:  00                                       .
18:03:08.495152 wlan0 In  IP Nintendo\032Wii\032U.lan.xadmin > archlinux.22250: UDP, length 18
        0x0000:  0800 0000 0000 0003 0001 0006 34af 2c9d  ............4.,.
        0x0010:  61de 0000 4500 002e 0679 0000 4011 9eea  a...E....y..@...
        0x0020:  0a13 608b 0a13 60ab 2391 56ea 001a 507f  ..`...`.#.V...P.
        0x0030:  3f31 2000 0000 0000 0000 0000 0000 e031  ?1.............1
        0x0040:  2000                                     ..
18:03:08.495152 wlan0 In  IP Nintendo\032Wii\032U.lan.xadmin > archlinux.22250: UDP, length 18
        0x0000:  0800 0000 0000 0003 0001 0006 34af 2c9d  ............4.,.
        0x0010:  61de 0000 4500 002e 067a 0000 4011 9ee9  a...E....z..@...
        0x0020:  0a13 608b 0a13 60ab 2391 56ea 001a 527f  ..`...`.#.V...R.
        0x0030:  3e31 2000 0000 0000 0000 0000 0000 df31  >1.............1
        0x0040:  2000                                     ..
18:03:08.495424 wlan0 Out IP archlinux.22250 > Nintendo\032Wii\032U.lan.xadmin: UDP, length 17
        0x0000:  0800 0000 0000 0003 0001 0406 f4a4 759b  ..............u.
        0x0010:  ccd3 0000 4500 002d 3bae 4000 4011 29b6  ....E..-;.@.@.).
        0x0020:  0a13 60ab 0a13 608b 56ea 2391 0019 d586  ..`...`.V.#.....
        0x0030:  313e 4800 0000 0000 0000 0000 0000 0000  1>H.............
        0x0040:  00                                       .
18:03:08.495452 wlan0 Out IP archlinux.22250 > Nintendo\032Wii\032U.lan.xadmin: UDP, length 17
        0x0000:  0800 0000 0000 0003 0001 0406 f4a4 759b  ..............u.
        0x0010:  ccd3 0000 4500 002d 3baf 4000 4011 29b5  ....E..-;.@.@.).
        0x0020:  0a13 60ab 0a13 608b 56ea 2391 0019 d586  ..`...`.V.#.....
        0x0030:  313f 4800 0000 0000 0000 0000 0000 0000  1?H.............
        0x0040:  00                                       .
18:03:11.362205 wlan0 In  IP Nintendo\032Wii\032U.lan.xadmin > archlinux.22250: UDP, length 18
        0x0000:  0800 0000 0000 0003 0001 0006 34af 2c9d  ............4.,.
        0x0010:  61de 0000 4500 002e 067b 0000 4011 9ee8  a...E....{..@...
        0x0020:  0a13 608b 0a13 60ab 2391 56ea 001a 507f  ..`...`.#.V...P.
        0x0030:  3f31 2000 0000 0000 0000 0000 0000 e031  ?1.............1
        0x0040:  2000                                     ..
18:03:11.362263 wlan0 In  IP Nintendo\032Wii\032U.lan.xadmin > archlinux.22250: UDP, length 18
        0x0000:  0800 0000 0000 0003 0001 0006 34af 2c9d  ............4.,.
        0x0010:  61de 0000 4500 002e 067c 0000 4011 9ee7  a...E....|..@...
        0x0020:  0a13 608b 0a13 60ab 2391 56ea 001a 527f  ..`...`.#.V...R.
        0x0030:  3e31 2000 0000 0000 0000 0000 0000 df31  >1.............1
        0x0040:  2000                                     ..
18:03:11.362415 wlan0 Out IP archlinux.22250 > Nintendo\032Wii\032U.lan.xadmin: UDP, length 17
        0x0000:  0800 0000 0000 0003 0001 0406 f4a4 759b  ..............u.
        0x0010:  ccd3 0000 4500 002d 44ab 4000 4011 20b9  ....E..-D.@.@...
        0x0020:  0a13 60ab 0a13 608b 56ea 2391 0019 d586  ..`...`.V.#.....
        0x0030:  313e 4800 0000 0000 0000 0000 0000 0000  1>H.............
        0x0040:  00                                       .
18:03:11.362468 wlan0 Out IP archlinux.22250 > Nintendo\032Wii\032U.lan.xadmin: UDP, length 17
        0x0000:  0800 0000 0000 0003 0001 0406 f4a4 759b  ..............u.
        0x0010:  ccd3 0000 4500 002d 44ac 4000 4011 20b8  ....E..-D.@.@...
        0x0020:  0a13 60ab 0a13 608b 56ea 2391 0019 d586  ..`...`.V.#.....
        0x0030:  313f 4800 0000 0000 0000 0000 0000 0000  1?H.............
        0x0040:  00                                       .
18:03:14.536603 wlan0 In  IP Nintendo\032Wii\032U.lan.xadmin > archlinux.22250: UDP, length 18
        0x0000:  0800 0000 0000 0003 0001 0006 34af 2c9d  ............4.,.
        0x0010:  61de 0000 4500 002e 067d 0000 4011 9ee6  a...E....}..@...
        0x0020:  0a13 608b 0a13 60ab 2391 56ea 001a 507f  ..`...`.#.V...P.
        0x0030:  3f31 2000 0000 0000 0000 0000 0000 e031  ?1.............1
        0x0040:  2000                                     ..
18:03:14.536657 wlan0 In  IP Nintendo\032Wii\032U.lan.xadmin > archlinux.22250: UDP, length 18
        0x0000:  0800 0000 0000 0003 0001 0006 34af 2c9d  ............4.,.
        0x0010:  61de 0000 4500 002e 067e 0000 4011 9ee5  a...E....~..@...
        0x0020:  0a13 608b 0a13 60ab 2391 56ea 001a 527f  ..`...`.#.V...R.
        0x0030:  3e31 2000 0000 0000 0000 0000 0000 df31  >1.............1
        0x0040:  2000                                     ..
18:03:14.536890 wlan0 Out IP archlinux.22250 > Nintendo\032Wii\032U.lan.xadmin: UDP, length 17
        0x0000:  0800 0000 0000 0003 0001 0406 f4a4 759b  ..............u.
        0x0010:  ccd3 0000 4500 002d 4f75 4000 4011 15ef  ....E..-Ou@.@...
        0x0020:  0a13 60ab 0a13 608b 56ea 2391 0019 d586  ..`...`.V.#.....
        0x0030:  313e 4800 0000 0000 0000 0000 0000 0000  1>H.............
        0x0040:  00                                       .
18:03:14.536988 wlan0 Out IP archlinux.22250 > Nintendo\032Wii\032U.lan.xadmin: UDP, length 17
        0x0000:  0800 0000 0000 0003 0001 0406 f4a4 759b  ..............u.
        0x0010:  ccd3 0000 4500 002d 4f76 4000 4011 15ee  ....E..-Ov@.@...
        0x0020:  0a13 60ab 0a13 608b 56ea 2391 0019 d586  ..`...`.V.#.....
        0x0030:  313f 4800 0000 0000 0000 0000 0000 0000  1?H.............
        0x0040:  00                                       .
18:03:18.018504 wlan0 In  IP Nintendo\032Wii\032U.lan.xadmin > archlinux.22250: UDP, length 18
        0x0000:  0800 0000 0000 0003 0001 0006 34af 2c9d  ............4.,.
        0x0010:  61de 0000 4500 002e 0680 0000 4011 9ee3  a...E.......@...
        0x0020:  0a13 608b 0a13 60ab 2391 56ea 001a 507f  ..`...`.#.V...P.
        0x0030:  3f31 2000 0000 0000 0000 0000 0000 e031  ?1.............1
        0x0040:  2000                                     ..
18:03:18.018546 wlan0 In  IP Nintendo\032Wii\032U.lan.xadmin > archlinux.22250: UDP, length 18
        0x0000:  0800 0000 0000 0003 0001 0006 34af 2c9d  ............4.,.
        0x0010:  61de 0000 4500 002e 0681 0000 4011 9ee2  a...E.......@...
        0x0020:  0a13 608b 0a13 60ab 2391 56ea 001a 527f  ..`...`.#.V...R.
        0x0030:  3e31 2000 0000 0000 0000 0000 0000 df31  >1.............1
        0x0040:  2000                                     ..
18:03:18.018701 wlan0 Out IP archlinux.22250 > Nintendo\032Wii\032U.lan.xadmin: UDP, length 17
        0x0000:  0800 0000 0000 0003 0001 0406 f4a4 759b  ..............u.
        0x0010:  ccd3 0000 4500 002d 52c8 4000 4011 129c  ....E..-R.@.@...
        0x0020:  0a13 60ab 0a13 608b 56ea 2391 0019 d586  ..`...`.V.#.....
        0x0030:  313e 4800 0000 0000 0000 0000 0000 0000  1>H.............
        0x0040:  00                                       .
18:03:18.018734 wlan0 Out IP archlinux.22250 > Nintendo\032Wii\032U.lan.xadmin: UDP, length 17
        0x0000:  0800 0000 0000 0003 0001 0406 f4a4 759b  ..............u.
        0x0010:  ccd3 0000 4500 002d 52c9 4000 4011 129b  ....E..-R.@.@...
        0x0020:  0a13 60ab 0a13 608b 56ea 2391 0019 d586  ..`...`.V.#.....
        0x0030:  313f 4800 0000 0000 0000 0000 0000 0000  1?H.............
        0x0040:  00                                       .
18:03:21.706252 wlan0 In  IP Nintendo\032Wii\032U.lan.xadmin > archlinux.22250: UDP, length 18
        0x0000:  0800 0000 0000 0003 0001 0006 34af 2c9d  ............4.,.
        0x0010:  61de 0000 4500 002e 0682 0000 4011 9ee1  a...E.......@...
        0x0020:  0a13 608b 0a13 60ab 2391 56ea 001a 507f  ..`...`.#.V...P.
        0x0030:  3f31 2000 0000 0000 0000 0000 0000 e031  ?1.............1
        0x0040:  2000                                     ..
18:03:21.706252 wlan0 In  IP Nintendo\032Wii\032U.lan.xadmin > archlinux.22250: UDP, length 18
        0x0000:  0800 0000 0000 0003 0001 0006 34af 2c9d  ............4.,.
        0x0010:  61de 0000 4500 002e 0683 0000 4011 9ee0  a...E.......@...
        0x0020:  0a13 608b 0a13 60ab 2391 56ea 001a 527f  ..`...`.#.V...R.
        0x0030:  3e31 2000 0000 0000 0000 0000 0000 df31  >1.............1
        0x0040:  2000                                     ..
18:03:21.706495 wlan0 Out IP archlinux.22250 > Nintendo\032Wii\032U.lan.xadmin: UDP, length 17
        0x0000:  0800 0000 0000 0003 0001 0406 f4a4 759b  ..............u.
        0x0010:  ccd3 0000 4500 002d 5666 4000 4011 0efe  ....E..-Vf@.@...
        0x0020:  0a13 60ab 0a13 608b 56ea 2391 0019 d586  ..`...`.V.#.....
        0x0030:  313e 4800 0000 0000 0000 0000 0000 0000  1>H.............
        0x0040:  00                                       .
18:03:21.706602 wlan0 Out IP archlinux.22250 > Nintendo\032Wii\032U.lan.xadmin: UDP, length 17
        0x0000:  0800 0000 0000 0003 0001 0406 f4a4 759b  ..............u.
        0x0010:  ccd3 0000 4500 002d 5667 4000 4011 0efd  ....E..-Vg@.@...
        0x0020:  0a13 60ab 0a13 608b 56ea 2391 0019 d586  ..`...`.V.#.....
        0x0030:  313f 4800 0000 0000 0000 0000 0000 0000  1?H.............
        0x0040:  00                                       .
18:03:25.800673 wlan0 In  IP Nintendo\032Wii\032U.lan.xadmin > archlinux.22250: UDP, length 18
        0x0000:  0800 0000 0000 0003 0001 0006 34af 2c9d  ............4.,.
        0x0010:  61de 0000 4500 002e 0684 0000 4011 9edf  a...E.......@...
        0x0020:  0a13 608b 0a13 60ab 2391 56ea 001a 507f  ..`...`.#.V...P.
        0x0030:  3f31 2000 0000 0000 0000 0000 0000 e031  ?1.............1
        0x0040:  2000                                     ..
18:03:25.800733 wlan0 In  IP Nintendo\032Wii\032U.lan.xadmin > archlinux.22250: UDP, length 18
        0x0000:  0800 0000 0000 0003 0001 0006 34af 2c9d  ............4.,.
        0x0010:  61de 0000 4500 002e 0685 0000 4011 9ede  a...E.......@...
        0x0020:  0a13 608b 0a13 60ab 2391 56ea 001a 527f  ..`...`.#.V...R.
        0x0030:  3e31 2000 0000 0000 0000 0000 0000 df31  >1.............1
        0x0040:  2000                                     ..
18:03:25.800983 wlan0 Out IP archlinux.22250 > Nintendo\032Wii\032U.lan.xadmin: UDP, length 17
        0x0000:  0800 0000 0000 0003 0001 0406 f4a4 759b  ..............u.
        0x0010:  ccd3 0000 4500 002d 6164 4000 4011 0400  ....E..-ad@.@...
        0x0020:  0a13 60ab 0a13 608b 56ea 2391 0019 d586  ..`...`.V.#.....
        0x0030:  313e 4800 0000 0000 0000 0000 0000 0000  1>H.............
        0x0040:  00                                       .
18:03:25.801063 wlan0 Out IP archlinux.22250 > Nintendo\032Wii\032U.lan.xadmin: UDP, length 17
        0x0000:  0800 0000 0000 0003 0001 0406 f4a4 759b  ..............u.
        0x0010:  ccd3 0000 4500 002d 6165 4000 4011 03ff  ....E..-ae@.@...
        0x0020:  0a13 60ab 0a13 608b 56ea 2391 0019 d586  ..`...`.V.#.....
        0x0030:  313f 4800 0000 0000 0000 0000 0000 0000  1?H.............
        0x0040:  00   
```


packets WITH enhanced checksum enabled
```
18:05:49.369662 wlan0 In  IP Nintendo\032Wii\032U.lan.xadmin > archlinux.22250: UDP, length 18
        0x0000:  0800 0000 0000 0003 0001 0006 34af 2c9d  ............4.,.
        0x0010:  61de 0000 4500 002e 071d 0000 4011 9e46  a...E.......@..F
        0x0020:  0a13 608b 0a13 60ab 2391 56ea 001a 507f  ..`...`.#.V...P.
        0x0030:  3f31 2000 0000 0000 0000 0000 0000 e031  ?1.............1
        0x0040:  2000                                     ..
18:05:49.385056 wlan0 In  IP Nintendo\032Wii\032U.lan.xadmin > archlinux.22250: UDP, length 18
        0x0000:  0800 0000 0000 0003 0001 0006 34af 2c9d  ............4.,.
        0x0010:  61de 0000 4500 002e 071e 0000 4011 9e45  a...E.......@..E
        0x0020:  0a13 608b 0a13 60ab 2391 56ea 001a 527f  ..`...`.#.V...R.
        0x0030:  3e31 2000 0000 0000 0000 0000 0000 df31  >1.............1
        0x0040:  2000                                     ..
18:05:49.700106 wlan0 In  IP Nintendo\032Wii\032U.lan.xadmin > archlinux.22250: UDP, length 18
        0x0000:  0800 0000 0000 0003 0001 0006 34af 2c9d  ............4.,.
        0x0010:  61de 0000 4500 002e 071f 0000 4011 9e44  a...E.......@..D
        0x0020:  0a13 608b 0a13 60ab 2391 56ea 001a 507f  ..`...`.#.V...P.
        0x0030:  3f31 2000 0000 0000 0000 0000 0000 e031  ?1.............1
        0x0040:  2000                                     ..
18:05:49.716455 wlan0 In  IP Nintendo\032Wii\032U.lan.xadmin > archlinux.22250: UDP, length 18
        0x0000:  0800 0000 0000 0003 0001 0006 34af 2c9d  ............4.,.
        0x0010:  61de 0000 4500 002e 0720 0000 4011 9e43  a...E.......@..C
        0x0020:  0a13 608b 0a13 60ab 2391 56ea 001a 527f  ..`...`.#.V...R.
        0x0030:  3e31 2000 0000 0000 0000 0000 0000 df31  >1.............1
        0x0040:  2000                                     ..
18:05:50.390442 wlan0 In  IP Nintendo\032Wii\032U.lan.xadmin > archlinux.22250: UDP, length 18
        0x0000:  0800 0000 0000 0003 0001 0006 34af 2c9d  ............4.,.
        0x0010:  61de 0000 4500 002e 0721 0000 4011 9e42  a...E....!..@..B
        0x0020:  0a13 608b 0a13 60ab 2391 56ea 001a 507f  ..`...`.#.V...P.
        0x0030:  3f31 2000 0000 0000 0000 0000 0000 e031  ?1.............1
        0x0040:  2000                                     ..
18:05:50.390534 wlan0 In  IP Nintendo\032Wii\032U.lan.xadmin > archlinux.22250: UDP, length 18
        0x0000:  0800 0000 0000 0003 0001 0006 34af 2c9d  ............4.,.
        0x0010:  61de 0000 4500 002e 0722 0000 4011 9e41  a...E...."..@..A
        0x0020:  0a13 608b 0a13 60ab 2391 56ea 001a 527f  ..`...`.#.V...R.
        0x0030:  3e31 2000 0000 0000 0000 0000 0000 df31  >1.............1
        0x0040:  2000                                     ..
18:05:51.312865 wlan0 In  IP Nintendo\032Wii\032U.lan.xadmin > archlinux.22250: UDP, length 18
        0x0000:  0800 0000 0000 0003 0001 0006 34af 2c9d  ............4.,.
        0x0010:  61de 0000 4500 002e 0723 0000 4011 9e40  a...E....#..@..@
        0x0020:  0a13 608b 0a13 60ab 2391 56ea 001a 507f  ..`...`.#.V...P.
        0x0030:  3f31 2000 0000 0000 0000 0000 0000 e031  ?1.............1
        0x0040:  2000                                     ..
18:05:51.318277 wlan0 In  IP Nintendo\032Wii\032U.lan.xadmin > archlinux.22250: UDP, length 18
        0x0000:  0800 0000 0000 0003 0001 0006 34af 2c9d  ............4.,.
        0x0010:  61de 0000 4500 002e 0724 0000 4011 9e3f  a...E....$..@..?
        0x0020:  0a13 608b 0a13 60ab 2391 56ea 001a 527f  ..`...`.#.V...R.
        0x0030:  3e31 2000 0000 0000 0000 0000 0000 df31  >1.............1
        0x0040:  2000                                     ..
18:05:52.643177 wlan0 In  IP Nintendo\032Wii\032U.lan.xadmin > archlinux.22250: UDP, length 18
        0x0000:  0800 0000 0000 0003 0001 0006 34af 2c9d  ............4.,.
        0x0010:  61de 0000 4500 002e 0725 0000 4011 9e3e  a...E....%..@..>
        0x0020:  0a13 608b 0a13 60ab 2391 56ea 001a 507f  ..`...`.#.V...P.
        0x0030:  3f31 2000 0000 0000 0000 0000 0000 e031  ?1.............1
        0x0040:  2000                                     ..
18:05:52.643256 wlan0 In  IP Nintendo\032Wii\032U.lan.xadmin > archlinux.22250: UDP, length 18
        0x0000:  0800 0000 0000 0003 0001 0006 34af 2c9d  ............4.,.
        0x0010:  61de 0000 4500 002e 0726 0000 4011 9e3d  a...E....&..@..=
        0x0020:  0a13 608b 0a13 60ab 2391 56ea 001a 527f  ..`...`.#.V...R.
        0x0030:  3e31 2000 0000 0000 0000 0000 0000 df31  >1.............1
        0x0040:  2000                                     ..
18:05:54.179966 wlan0 In  IP Nintendo\032Wii\032U.lan.xadmin > archlinux.22250: UDP, length 18
        0x0000:  0800 0000 0000 0003 0001 0006 34af 2c9d  ............4.,.
        0x0010:  61de 0000 4500 002e 0727 0000 4011 9e3c  a...E....'..@..<
        0x0020:  0a13 608b 0a13 60ab 2391 56ea 001a 507f  ..`...`.#.V...P.
        0x0030:  3f31 2000 0000 0000 0000 0000 0000 e031  ?1.............1
        0x0040:  2000                                     ..
18:05:54.180066 wlan0 In  IP Nintendo\032Wii\032U.lan.xadmin > archlinux.22250: UDP, length 18
        0x0000:  0800 0000 0000 0003 0001 0006 34af 2c9d  ............4.,.
        0x0010:  61de 0000 4500 002e 0728 0000 4011 9e3b  a...E....(..@..;
        0x0020:  0a13 608b 0a13 60ab 2391 56ea 001a 527f  ..`...`.#.V...R.
        0x0030:  3e31 2000 0000 0000 0000 0000 0000 df31  >1.............1
        0x0040:  2000                                     ..
18:05:56.124909 wlan0 In  IP Nintendo\032Wii\032U.lan.xadmin > archlinux.22250: UDP, length 18
        0x0000:  0800 0000 0000 0003 0001 0006 34af 2c9d  ............4.,.
        0x0010:  61de 0000 4500 002e 072b 0000 4011 9e38  a...E....+..@..8
        0x0020:  0a13 608b 0a13 60ab 2391 56ea 001a 507f  ..`...`.#.V...P.
        0x0030:  3f31 2000 0000 0000 0000 0000 0000 e031  ?1.............1
        0x0040:  2000                                     ..
18:05:56.124910 wlan0 In  IP Nintendo\032Wii\032U.lan.xadmin > archlinux.22250: UDP, length 18
        0x0000:  0800 0000 0000 0003 0001 0006 34af 2c9d  ............4.,.
        0x0010:  61de 0000 4500 002e 072c 0000 4011 9e37  a...E....,..@..7
        0x0020:  0a13 608b 0a13 60ab 2391 56ea 001a 527f  ..`...`.#.V...R.
        0x0030:  3e31 2000 0000 0000 0000 0000 0000 df31  >1.............1
        0x0040:  2000                                     ..
18:05:58.275319 wlan0 In  IP Nintendo\032Wii\032U.lan.xadmin > archlinux.22250: UDP, length 18
        0x0000:  0800 0000 0000 0003 0001 0006 34af 2c9d  ............4.,.
        0x0010:  61de 0000 4500 002e 072d 0000 4011 9e36  a...E....-..@..6
        0x0020:  0a13 608b 0a13 60ab 2391 56ea 001a 507f  ..`...`.#.V...P.
        0x0030:  3f31 2000 0000 0000 0000 0000 0000 e031  ?1.............1
        0x0040:  2000                                     ..
18:05:58.275361 wlan0 In  IP Nintendo\032Wii\032U.lan.xadmin > archlinux.22250: UDP, length 18
        0x0000:  0800 0000 0000 0003 0001 0006 34af 2c9d  ............4.,.
        0x0010:  61de 0000 4500 002e 072e 0000 4011 9e35  a...E.......@..5
        0x0020:  0a13 608b 0a13 60ab 2391 56ea 001a 527f  ..`...`.#.V...R.
        0x0030:  3e31 2000 0000 0000 0000 0000 0000 df31  >1.............1
        0x0040:  2000                                     ..
18:06:00.834714 wlan0 In  IP Nintendo\032Wii\032U.lan.xadmin > archlinux.22250: UDP, length 18
        0x0000:  0800 0000 0000 0003 0001 0006 34af 2c9d  ............4.,.
        0x0010:  61de 0000 4500 002e 072f 0000 4011 9e34  a...E..../..@..4
        0x0020:  0a13 608b 0a13 60ab 2391 56ea 001a 507f  ..`...`.#.V...P.
        0x0030:  3f31 2000 0000 0000 0000 0000 0000 e031  ?1.............1
        0x0040:  2000                                     ..
18:06:00.834758 wlan0 In  IP Nintendo\032Wii\032U.lan.xadmin > archlinux.22250: UDP, length 18
        0x0000:  0800 0000 0000 0003 0001 0006 34af 2c9d  ............4.,.
        0x0010:  61de 0000 4500 002e 0730 0000 4011 9e33  a...E....0..@..3
        0x0020:  0a13 608b 0a13 60ab 2391 56ea 001a 527f  ..`...`.#.V...R.
        0x0030:  3e31 2000 0000 0000 0000 0000 0000 df31  >1.............1
        0x0040:  2000                                     ..
18:06:03.580833 wlan0 In  IP Nintendo\032Wii\032U.lan.xadmin > archlinux.22250: UDP, length 18
        0x0000:  0800 0000 0000 0003 0001 0006 34af 2c9d  ............4.,.
        0x0010:  61de 0000 4500 002e 0731 0000 4011 9e32  a...E....1..@..2
        0x0020:  0a13 608b 0a13 60ab 2391 56ea 001a 507f  ..`...`.#.V...P.
        0x0030:  3f31 2000 0000 0000 0000 0000 0000 e031  ?1.............1
        0x0040:  2000                                     ..
18:06:03.597181 wlan0 In  IP Nintendo\032Wii\032U.lan.xadmin > archlinux.22250: UDP, length 18
        0x0000:  0800 0000 0000 0003 0001 0006 34af 2c9d  ............4.,.
        0x0010:  61de 0000 4500 002e 0732 0000 4011 9e31  a...E....2..@..1
        0x0020:  0a13 608b 0a13 60ab 2391 56ea 001a 527f  ..`...`.#.V...R.
        0x0030:  3e31 2000 0000 0000 0000 0000 0000 df31  >1.............1
        0x0040:  2000                                     ..
18:06:06.777154 wlan0 In  IP Nintendo\032Wii\032U.lan.xadmin > archlinux.22250: UDP, length 18
        0x0000:  0800 0000 0000 0003 0001 0006 34af 2c9d  ............4.,.
        0x0010:  61de 0000 4500 002e 0734 0000 4011 9e2f  a...E....4..@../
        0x0020:  0a13 608b 0a13 60ab 2391 56ea 001a 507f  ..`...`.#.V...P.
        0x0030:  3f31 2000 0000 0000 0000 0000 0000 e031  ?1.............1
        0x0040:  2000                                     ..
18:06:06.777155 wlan0 In  IP Nintendo\032Wii\032U.lan.xadmin > archlinux.22250: UDP, length 18
        0x0000:  0800 0000 0000 0003 0001 0006 34af 2c9d  ............4.,.
        0x0010:  61de 0000 4500 002e 0735 0000 4011 9e2e  a...E....5..@...
        0x0020:  0a13 608b 0a13 60ab 2391 56ea 001a 527f  ..`...`.#.V...R.
        0x0030:  3e31 2000 0000 0000 0000 0000 0000 df31  >1.............1
        0x0040:  2000                                     ..
18:06:10.187928 wlan0 In  IP Nintendo\032Wii\032U.lan.xadmin > archlinux.22250: UDP, length 18
        0x0000:  0800 0000 0000 0003 0001 0006 34af 2c9d  ............4.,.
        0x0010:  61de 0000 4500 002e 0736 0000 4011 9e2d  a...E....6..@..-
        0x0020:  0a13 608b 0a13 60ab 2391 56ea 001a 507f  ..`...`.#.V...P.
        0x0030:  3f31 2000 0000 0000 0000 0000 0000 e031  ?1.............1
        0x0040:  2000                                     ..
18:06:10.203794 wlan0 In  IP Nintendo\032Wii\032U.lan.xadmin > archlinux.22250: UDP, length 18
        0x0000:  0800 0000 0000 0003 0001 0006 34af 2c9d  ............4.,.
        0x0010:  61de 0000 4500 002e 0737 0000 4011 9e2c  a...E....7..@..,
        0x0020:  0a13 608b 0a13 60ab 2391 56ea 001a 527f  ..`...`.#.V...R.
        0x0030:  3e31 2000 0000 0000 0000 0000 0000 df31  >1.............1
        0x0040:  2000                                     ..
18:06:13.957895 wlan0 In  IP Nintendo\032Wii\032U.lan.xadmin > archlinux.22250: UDP, length 18
        0x0000:  0800 0000 0000 0003 0001 0006 34af 2c9d  ............4.,.
        0x0010:  61de 0000 4500 002e 0738 0000 4011 9e2b  a...E....8..@..+
        0x0020:  0a13 608b 0a13 60ab 2391 56ea 001a 507f  ..`...`.#.V...P.
        0x0030:  3f31 2000 0000 0000 0000 0000 0000 e031  ?1.............1
        0x0040:  2000                                     ..
18:06:13.974552 wlan0 In  IP Nintendo\032Wii\032U.lan.xadmin > archlinux.22250: UDP, length 18
        0x0000:  0800 0000 0000 0003 0001 0006 34af 2c9d  ............4.,.
        0x0010:  61de 0000 4500 002e 0739 0000 4011 9e2a  a...E....9..@..*
        0x0020:  0a13 608b 0a13 60ab 2391 56ea 001a 527f  ..`...`.#.V...R.
        0x0030:  3e31 2000 0000 0000 0000 0000 0000 df31  >1.............1
        0x0040:  2000                                     ..
18:06:18.038825 wlan0 In  IP Nintendo\032Wii\032U.lan.xadmin > archlinux.22250: UDP, length 18
        0x0000:  0800 0000 0000 0003 0001 0006 34af 2c9d  ............4.,.
        0x0010:  61de 0000 4500 002e 073c 0000 4011 9e27  a...E....<..@..'
        0x0020:  0a13 608b 0a13 60ab 2391 56ea 001a 507f  ..`...`.#.V...P.
        0x0030:  3f31 2000 0000 0000 0000 0000 0000 e031  ?1.............1
        0x0040:  2000                                     ..
18:06:18.044906 wlan0 In  IP Nintendo\032Wii\032U.lan.xadmin > archlinux.22250: UDP, length 18
        0x0000:  0800 0000 0000 0003 0001 0006 34af 2c9d  ............4.,.
        0x0010:  61de 0000 4500 002e 073d 0000 4011 9e26  a...E....=..@..&
        0x0020:  0a13 608b 0a13 60ab 2391 56ea 001a 527f  ..`...`.#.V...R.
        0x0030:  3e31 2000 0000 0000 0000 0000 0000 df31  >1.............1
        0x0040:  2000                                     ..

```

**Comment by GuestDreemurr** [comment]
finally got a access key so now i have packets between server and client (enhanced checksum seems to break something that causes server to silently reject any requests)

```
tcpdump: WARNING: any: That device doesn't support promiscuous mode
(Promiscuous mode not supported on the "any" device)
tcpdump: verbose output suppressed, use -v[v]... for full protocol decode
listening on any, link-type LINUX_SLL2 (Linux cooked v2), snapshot length 262144 bytes
14:47:36.693022 wlan0 In  IP Nintendo\032Wii\032U.lan.xadmin > archlinux.lan.22250: UDP, length 18
        0x0000:  0800 0000 0000 0003 0001 0006 34af 2c9d  ............4.,.
        0x0010:  61de 0000 4500 002e 057e 0000 4011 9fe4  a...E....~..@...
        0x0020:  0a13 608b 0a13 60ac 2391 56ea 001a 507e  ..`...`.#.V...P~
        0x0030:  3f31 2000 0000 0000 0000 0000 0000 e031  ?1.............1
        0x0040:  2000                                     ..
14:47:36.704746 wlan0 In  IP Nintendo\032Wii\032U.lan.xadmin > archlinux.lan.22250: UDP, length 18
        0x0000:  0800 0000 0000 0003 0001 0006 34af 2c9d  ............4.,.
        0x0010:  61de 0000 4500 002e 057f 0000 4011 9fe3  a...E.......@...
        0x0020:  0a13 608b 0a13 60ac 2391 56ea 001a 527e  ..`...`.#.V...R~
        0x0030:  3e31 2000 0000 0000 0000 0000 0000 df31  >1.............1
        0x0040:  2000                                     ..
14:47:36.704973 wlan0 Out IP archlinux.22250 > Nintendo\032Wii\032U.lan.xadmin: UDP, length 17
        0x0000:  0800 0000 0000 0003 0001 0406 f4a4 759b  ..............u.
        0x0010:  ccd3 0000 4500 002d a8bf 4000 4011 bca4  ....E..-..@.@...
        0x0020:  0a13 60ab 0a13 608b 56ea 2391 0019 d586  ..`...`.V.#.....
        0x0030:  313e 4800 0000 0000 0000 1eea 7adf 0000  1>H.........z...
        0x0040:  5a                                       Z
14:47:37.027993 wlan0 In  IP Nintendo\032Wii\032U.lan.xadmin > archlinux.lan.22250: UDP, length 18
        0x0000:  0800 0000 0000 0003 0001 0006 34af 2c9d  ............4.,.
        0x0010:  61de 0000 4500 002e 0580 0000 4011 9fe2  a...E.......@...
        0x0020:  0a13 608b 0a13 60ac 2391 56ea 001a 507e  ..`...`.#.V...P~
        0x0030:  3f31 2000 0000 0000 0000 0000 0000 e031  ?1.............1
        0x0040:  2000                                     ..
14:47:37.035722 wlan0 In  IP Nintendo\032Wii\032U.lan.xadmin > archlinux.lan.22250: UDP, length 18
        0x0000:  0800 0000 0000 0003 0001 0006 34af 2c9d  ............4.,.
        0x0010:  61de 0000 4500 002e 0581 0000 4011 9fe1  a...E.......@...
        0x0020:  0a13 608b 0a13 60ac 2391 56ea 001a 527e  ..`...`.#.V...R~
        0x0030:  3e31 2000 0000 0000 0000 0000 0000 df31  >1.............1
        0x0040:  2000                                     ..
14:47:37.036036 wlan0 Out IP archlinux.22250 > Nintendo\032Wii\032U.lan.xadmin: UDP, length 17
        0x0000:  0800 0000 0000 0003 0001 0406 f4a4 759b  ..............u.
        0x0010:  ccd3 0000 4500 002d a9c4 4000 4011 bb9f  ....E..-..@.@...
        0x0020:  0a13 60ab 0a13 608b 56ea 2391 0019 d586  ..`...`.V.#.....
        0x0030:  313e 4800 0000 0000 0000 1eea 7adf 0000  1>H.........z...
        0x0040:  5a                                       Z
14:47:37.744553 wlan0 In  IP Nintendo\032Wii\032U.lan.xadmin > archlinux.lan.22250: UDP, length 18
        0x0000:  0800 0000 0000 0003 0001 0006 34af 2c9d  ............4.,.
        0x0010:  61de 0000 4500 002e 0582 0000 4011 9fe0  a...E.......@...
        0x0020:  0a13 608b 0a13 60ac 2391 56ea 001a 507e  ..`...`.#.V...P~
        0x0030:  3f31 2000 0000 0000 0000 0000 0000 e031  ?1.............1
        0x0040:  2000                                     ..
14:47:37.744698 wlan0 In  IP Nintendo\032Wii\032U.lan.xadmin > archlinux.lan.22250: UDP, length 18
        0x0000:  0800 0000 0000 0003 0001 0006 34af 2c9d  ............4.,.
        0x0010:  61de 0000 4500 002e 0583 0000 4011 9fdf  a...E.......@...
        0x0020:  0a13 608b 0a13 60ac 2391 56ea 001a 527e  ..`...`.#.V...R~
        0x0030:  3e31 2000 0000 0000 0000 0000 0000 df31  >1.............1
        0x0040:  2000                                     ..
14:47:37.744954 wlan0 Out IP archlinux.22250 > Nintendo\032Wii\032U.lan.xadmin: UDP, length 17
        0x0000:  0800 0000 0000 0003 0001 0406 f4a4 759b  ..............u.
        0x0010:  ccd3 0000 4500 002d aa8b 4000 4011 bad8  ....E..-..@.@...
        0x0020:  0a13 60ab 0a13 608b 56ea 2391 0019 d586  ..`...`.V.#.....
        0x0030:  313e 4800 0000 0000 0000 1eea 7adf 0000  1>H.........z...
        0x0040:  5a                                       Z
14:47:38.666848 wlan0 In  IP Nintendo\032Wii\032U.lan.xadmin > archlinux.lan.22250: UDP, length 18
        0x0000:  0800 0000 0000 0003 0001 0006 34af 2c9d  ............4.,.
        0x0010:  61de 0000 4500 002e 0584 0000 4011 9fde  a...E.......@...
        0x0020:  0a13 608b 0a13 60ac 2391 56ea 001a 507e  ..`...`.#.V...P~
        0x0030:  3f31 2000 0000 0000 0000 0000 0000 e031  ?1.............1
        0x0040:  2000                                     ..
14:47:38.666848 wlan0 In  IP Nintendo\032Wii\032U.lan.xadmin > archlinux.lan.22250: UDP, length 18
        0x0000:  0800 0000 0000 0003 0001 0006 34af 2c9d  ............4.,.
        0x0010:  61de 0000 4500 002e 0585 0000 4011 9fdd  a...E.......@...
        0x0020:  0a13 608b 0a13 60ac 2391 56ea 001a 527e  ..`...`.#.V...R~
        0x0030:  3e31 2000 0000 0000 0000 0000 0000 df31  >1.............1
        0x0040:  2000                                     ..
14:47:38.667032 wlan0 Out IP archlinux.22250 > Nintendo\032Wii\032U.lan.xadmin: UDP, length 17
        0x0000:  0800 0000 0000 0003 0001 0406 f4a4 759b  ..............u.
        0x0010:  ccd3 0000 4500 002d ac35 4000 4011 b92e  ....E..-.5@.@...
        0x0020:  0a13 60ab 0a13 608b 56ea 2391 0019 d586  ..`...`.V.#.....
        0x0030:  313e 4800 0000 0000 0000 1eea 7adf 0000  1>H.........z...
        0x0040:  5a                                       Z
14:47:39.895853 wlan0 In  IP Nintendo\032Wii\032U.lan.xadmin > archlinux.lan.22250: UDP, length 18
        0x0000:  0800 0000 0000 0003 0001 0006 34af 2c9d  ............4.,.
        0x0010:  61de 0000 4500 002e 0586 0000 4011 9fdc  a...E.......@...
        0x0020:  0a13 608b 0a13 60ac 2391 56ea 001a 507e  ..`...`.#.V...P~
        0x0030:  3f31 2000 0000 0000 0000 0000 0000 e031  ?1.............1
        0x0040:  2000                                     ..
14:47:39.905532 wlan0 In  IP Nintendo\032Wii\032U.lan.xadmin > archlinux.lan.22250: UDP, length 18
        0x0000:  0800 0000 0000 0003 0001 0006 34af 2c9d  ............4.,.
        0x0010:  61de 0000 4500 002e 0587 0000 4011 9fdb  a...E.......@...
        0x0020:  0a13 608b 0a13 60ac 2391 56ea 001a 527e  ..`...`.#.V...R~
        0x0030:  3e31 2000 0000 0000 0000 0000 0000 df31  >1.............1
        0x0040:  2000                                     ..
14:47:39.905824 wlan0 Out IP archlinux.22250 > Nintendo\032Wii\032U.lan.xadmin: UDP, length 17
        0x0000:  0800 0000 0000 0003 0001 0406 f4a4 759b  ..............u.
        0x0010:  ccd3 0000 4500 002d ac88 4000 4011 b8db  ....E..-..@.@...
        0x0020:  0a13 60ab 0a13 608b 56ea 2391 0019 d586  ..`...`.V.#.....
        0x0030:  313e 4800 0000 0000 0000 1eea 7adf 0000  1>H.........z...
        0x0040:  5a                                       Z
14:47:41.458300 wlan0 In  IP Nintendo\032Wii\032U.lan.xadmin > archlinux.lan.22250: UDP, length 18
        0x0000:  0800 0000 0000 0003 0001 0006 34af 2c9d  ............4.,.
        0x0010:  61de 0000 4500 002e 0588 0000 4011 9fda  a...E.......@...
        0x0020:  0a13 608b 0a13 60ac 2391 56ea 001a 507e  ..`...`.#.V...P~
        0x0030:  3f31 2000 0000 0000 0000 0000 0000 e031  ?1.............1
        0x0040:  2000                                     ..
14:47:41.474233 wlan0 In  IP Nintendo\032Wii\032U.lan.xadmin > archlinux.lan.22250: UDP, length 18
        0x0000:  0800 0000 0000 0003 0001 0006 34af 2c9d  ............4.,.
        0x0010:  61de 0000 4500 002e 0589 0000 4011 9fd9  a...E.......@...
        0x0020:  0a13 608b 0a13 60ac 2391 56ea 001a 527e  ..`...`.#.V...R~
        0x0030:  3e31 2000 0000 0000 0000 0000 0000 df31  >1.............1
        0x0040:  2000                                     ..
14:47:41.474410 wlan0 Out IP archlinux.22250 > Nintendo\032Wii\032U.lan.xadmin: UDP, length 17
        0x0000:  0800 0000 0000 0003 0001 0406 f4a4 759b  ..............u.
        0x0010:  ccd3 0000 4500 002d b16f 4000 4011 b3f4  ....E..-.o@.@...
        0x0020:  0a13 60ab 0a13 608b 56ea 2391 0019 d586  ..`...`.V.#.....
        0x0030:  313e 4800 0000 0000 0000 1eea 7adf 0000  1>H.........z...
        0x0040:  5a                                       Z
14:47:43.359477 wlan0 In  IP Nintendo\032Wii\032U.lan.xadmin > archlinux.lan.22250: UDP, length 18
        0x0000:  0800 0000 0000 0003 0001 0006 34af 2c9d  ............4.,.
        0x0010:  61de 0000 4500 002e 058b 0000 4011 9fd7  a...E.......@...
        0x0020:  0a13 608b 0a13 60ac 2391 56ea 001a 507e  ..`...`.#.V...P~
        0x0030:  3f31 2000 0000 0000 0000 0000 0000 e031  ?1.............1
        0x0040:  2000                                     ..
14:47:43.376050 wlan0 In  IP Nintendo\032Wii\032U.lan.xadmin > archlinux.lan.22250: UDP, length 18
        0x0000:  0800 0000 0000 0003 0001 0006 34af 2c9d  ............4.,.
        0x0010:  61de 0000 4500 002e 058c 0000 4011 9fd6  a...E.......@...
        0x0020:  0a13 608b 0a13 60ac 2391 56ea 001a 527e  ..`...`.#.V...R~
        0x0030:  3e31 2000 0000 0000 0000 0000 0000 df31  >1.............1
        0x0040:  2000                                     ..
14:47:43.377857 wlan0 Out IP archlinux.22250 > Nintendo\032Wii\032U.lan.xadmin: UDP, length 17
        0x0000:  0800 0000 0000 0003 0001 0406 f4a4 759b  ..............u.
        0x0010:  ccd3 0000 4500 002d b7ad 4000 4011 adb6  ....E..-..@.@...
        0x0020:  0a13 60ab 0a13 608b 56ea 2391 0019 d586  ..`...`.V.#.....
        0x0030:  313e 4800 0000 0000 0000 1eea 7adf 0000  1>H.........z...
        0x0040:  5a                                       Z
14:47:45.564048 wlan0 In  IP Nintendo\032Wii\032U.lan.xadmin > archlinux.lan.22250: UDP, length 18
        0x0000:  0800 0000 0000 0003 0001 0006 34af 2c9d  ............4.,.
        0x0010:  61de 0000 4500 002e 058d 0000 4011 9fd5  a...E.......@...
        0x0020:  0a13 608b 0a13 60ac 2391 56ea 001a 507e  ..`...`.#.V...P~
        0x0030:  3f31 2000 0000 0000 0000 0000 0000 e031  ?1.............1
        0x0040:  2000                                     ..
14:47:45.592195 wlan0 In  IP Nintendo\032Wii\032U.lan.xadmin > archlinux.lan.22250: UDP, length 18
        0x0000:  0800 0000 0000 0003 0001 0006 34af 2c9d  ............4.,.
        0x0010:  61de 0000 4500 002e 058e 0000 4011 9fd4  a...E.......@...
        0x0020:  0a13 608b 0a13 60ac 2391 56ea 001a 527e  ..`...`.#.V...R~
        0x0030:  3e31 2000 0000 0000 0000 0000 0000 df31  >1.............1
        0x0040:  2000                                     ..
14:47:45.592418 wlan0 Out IP archlinux.22250 > Nintendo\032Wii\032U.lan.xadmin: UDP, length 17
        0x0000:  0800 0000 0000 0003 0001 0406 f4a4 759b  ..............u.
        0x0010:  ccd3 0000 4500 002d bdde 4000 4011 a785  ....E..-..@.@...
        0x0020:  0a13 60ab 0a13 608b 56ea 2391 0019 d586  ..`...`.V.#.....
        0x0030:  313e 4800 0000 0000 0000 1eea 7adf 0000  1>H.........z...
        0x0040:  5a                                       Z
14:47:48.087728 wlan0 In  IP Nintendo\032Wii\032U.lan.xadmin > archlinux.lan.22250: UDP, length 18
        0x0000:  0800 0000 0000 0003 0001 0006 34af 2c9d  ............4.,.
        0x0010:  61de 0000 4500 002e 058f 0000 4011 9fd3  a...E.......@...
        0x0020:  0a13 608b 0a13 60ac 2391 56ea 001a 507e  ..`...`.#.V...P~
        0x0030:  3f31 2000 0000 0000 0000 0000 0000 e031  ?1.............1
        0x0040:  2000                                     ..
14:47:48.087779 wlan0 In  IP Nintendo\032Wii\032U.lan.xadmin > archlinux.lan.22250: UDP, length 18
        0x0000:  0800 0000 0000 0003 0001 0006 34af 2c9d  ............4.,.
        0x0010:  61de 0000 4500 002e 0590 0000 4011 9fd2  a...E.......@...
        0x0020:  0a13 608b 0a13 60ac 2391 56ea 001a 527e  ..`...`.#.V...R~
        0x0030:  3e31 2000 0000 0000 0000 0000 0000 df31  >1.............1
        0x0040:  2000                                     ..
14:47:48.088027 wlan0 Out IP archlinux.22250 > Nintendo\032Wii\032U.lan.xadmin: UDP, length 17
        0x0000:  0800 0000 0000 0003 0001 0406 f4a4 759b  ..............u.
        0x0010:  ccd3 0000 4500 002d c78c 4000 4011 9dd7  ....E..-..@.@...
        0x0020:  0a13 60ab 0a13 608b 56ea 2391 0019 d586  ..`...`.V.#.....
        0x0030:  313e 4800 0000 0000 0000 1eea 7adf 0000  1>H.........z...
        0x0040:  5a                                       Z
14:47:50.954885 wlan0 In  IP Nintendo\032Wii\032U.lan.xadmin > archlinux.lan.22250: UDP, length 18
        0x0000:  0800 0000 0000 0003 0001 0006 34af 2c9d  ............4.,.
        0x0010:  61de 0000 4500 002e 0591 0000 4011 9fd1  a...E.......@...
        0x0020:  0a13 608b 0a13 60ac 2391 56ea 001a 507e  ..`...`.#.V...P~
        0x0030:  3f31 2000 0000 0000 0000 0000 0000 e031  ?1.............1
        0x0040:  2000                                     ..
14:47:50.954940 wlan0 In  IP Nintendo\032Wii\032U.lan.xadmin > archlinux.lan.22250: UDP, length 18
        0x0000:  0800 0000 0000 0003 0001 0006 34af 2c9d  ............4.,.
        0x0010:  61de 0000 4500 002e 0592 0000 4011 9fd0  a...E.......@...
        0x0020:  0a13 608b 0a13 60ac 2391 56ea 001a 527e  ..`...`.#.V...R~
        0x0030:  3e31 2000 0000 0000 0000 0000 0000 df31  >1.............1
        0x0040:  2000                                     ..
14:47:50.955222 wlan0 Out IP archlinux.22250 > Nintendo\032Wii\032U.lan.xadmin: UDP, length 17
        0x0000:  0800 0000 0000 0003 0001 0406 f4a4 759b  ..............u.
        0x0010:  ccd3 0000 4500 002d cd91 4000 4011 97d2  ....E..-..@.@...
        0x0020:  0a13 60ab 0a13 608b 56ea 2391 0019 d586  ..`...`.V.#.....
        0x0030:  313e 4800 0000 0000 0000 1eea 7adf 0000  1>H.........z...
        0x0040:  5a                                       Z
14:47:54.036832 wlan0 In  IP Nintendo\032Wii\032U.lan.xadmin > archlinux.lan.22250: UDP, length 18
        0x0000:  0800 0000 0000 0003 0001 0006 34af 2c9d  ............4.,.
        0x0010:  61de 0000 4500 002e 0595 0000 4011 9fcd  a...E.......@...
        0x0020:  0a13 608b 0a13 60ac 2391 56ea 001a 507e  ..`...`.#.V...P~
        0x0030:  3f31 2000 0000 0000 0000 0000 0000 e031  ?1.............1
        0x0040:  2000                                     ..
14:47:54.053224 wlan0 In  IP Nintendo\032Wii\032U.lan.xadmin > archlinux.lan.22250: UDP, length 18
        0x0000:  0800 0000 0000 0003 0001 0006 34af 2c9d  ............4.,.
        0x0010:  61de 0000 4500 002e 0596 0000 4011 9fcc  a...E.......@...
        0x0020:  0a13 608b 0a13 60ac 2391 56ea 001a 527e  ..`...`.#.V...R~
        0x0030:  3e31 2000 0000 0000 0000 0000 0000 df31  >1.............1
        0x0040:  2000                                     ..
14:47:54.053450 wlan0 Out IP archlinux.22250 > Nintendo\032Wii\032U.lan.xadmin: UDP, length 17
        0x0000:  0800 0000 0000 0003 0001 0406 f4a4 759b  ..............u.
        0x0010:  ccd3 0000 4500 002d d958 4000 4011 8c0b  ....E..-.X@.@...
        0x0020:  0a13 60ab 0a13 608b 56ea 2391 0019 d586  ..`...`.V.#.....
        0x0030:  313e 4800 0000 0000 0000 1eea 7adf 0000  1>H.........z...
        0x0040:  5a                                       Z
14:47:57.507289 wlan0 In  IP Nintendo\032Wii\032U.lan.xadmin > archlinux.lan.22250: UDP, length 18
        0x0000:  0800 0000 0000 0003 0001 0006 34af 2c9d  ............4.,.
        0x0010:  61de 0000 4500 002e 0597 0000 4011 9fcb  a...E.......@...
        0x0020:  0a13 608b 0a13 60ac 2391 56ea 001a 507e  ..`...`.#.V...P~
        0x0030:  3f31 2000 0000 0000 0000 0000 0000 e031  ?1.............1
        0x0040:  2000                                     ..
14:47:57.529402 wlan0 In  IP Nintendo\032Wii\032U.lan.xadmin > archlinux.lan.22250: UDP, length 18
        0x0000:  0800 0000 0000 0003 0001 0006 34af 2c9d  ............4.,.
        0x0010:  61de 0000 4500 002e 0598 0000 4011 9fca  a...E.......@...
        0x0020:  0a13 608b 0a13 60ac 2391 56ea 001a 527e  ..`...`.#.V...R~
        0x0030:  3e31 2000 0000 0000 0000 0000 0000 df31  >1.............1
        0x0040:  2000                                     ..
14:47:57.529600 wlan0 Out IP archlinux.22250 > Nintendo\032Wii\032U.lan.xadmin: UDP, length 17
        0x0000:  0800 0000 0000 0003 0001 0406 f4a4 759b  ..............u.
        0x0010:  ccd3 0000 4500 002d e574 4000 4011 7fef  ....E..-.t@.@...
        0x0020:  0a13 60ab 0a13 608b 56ea 2391 0019 d586  ..`...`.V.#.....
        0x0030:  313e 4800 0000 0000 0000 1eea 7adf 0000  1>H.........z...
        0x0040:  5a                                       Z
14:48:01.297204 wlan0 In  IP Nintendo\032Wii\032U.lan.xadmin > archlinux.lan.22250: UDP, length 18
        0x0000:  0800 0000 0000 0003 0001 0006 34af 2c9d  ............4.,.
        0x0010:  61de 0000 4500 002e 0599 0000 4011 9fc9  a...E.......@...
        0x0020:  0a13 608b 0a13 60ac 2391 56ea 001a 507e  ..`...`.#.V...P~
        0x0030:  3f31 2000 0000 0000 0000 0000 0000 e031  ?1.............1
        0x0040:  2000                                     ..
14:48:01.297291 wlan0 In  IP Nintendo\032Wii\032U.lan.xadmin > archlinux.lan.22250: UDP, length 18
        0x0000:  0800 0000 0000 0003 0001 0006 34af 2c9d  ............4.,.
        0x0010:  61de 0000 4500 002e 059a 0000 4011 9fc8  a...E.......@...
        0x0020:  0a13 608b 0a13 60ac 2391 56ea 001a 527e  ..`...`.#.V...R~
        0x0030:  3e31 2000 0000 0000 0000 0000 0000 df31  >1.............1
        0x0040:  2000                                     ..
14:48:01.297366 wlan0 Out IP archlinux.22250 > Nintendo\032Wii\032U.lan.xadmin: UDP, length 17
        0x0000:  0800 0000 0000 0003 0001 0406 f4a4 759b  ..............u.
        0x0010:  ccd3 0000 4500 002d ed23 4000 4011 7840  ....E..-.#@.@.x@
        0x0020:  0a13 60ab 0a13 608b 56ea 2391 0019 d586  ..`...`.V.#.....
        0x0030:  313e 4800 0000 0000 0000 1eea 7adf 0000  1>H.........z...
        0x0040:  5a                                       Z
14:48:05.393265 wlan0 In  IP Nintendo\032Wii\032U.lan.xadmin > archlinux.lan.22250: UDP, length 18
        0x0000:  0800 0000 0000 0003 0001 0006 34af 2c9d  ............4.,.
        0x0010:  61de 0000 4500 002e 059c 0000 4011 9fc6  a...E.......@...
        0x0020:  0a13 608b 0a13 60ac 2391 56ea 001a 507e  ..`...`.#.V...P~
        0x0030:  3f31 2000 0000 0000 0000 0000 0000 e031  ?1.............1
        0x0040:  2000                                     ..
14:48:05.393335 wlan0 In  IP Nintendo\032Wii\032U.lan.xadmin > archlinux.lan.22250: UDP, length 18
        0x0000:  0800 0000 0000 0003 0001 0006 34af 2c9d  ............4.,.
        0x0010:  61de 0000 4500 002e 059d 0000 4011 9fc5  a...E.......@...
        0x0020:  0a13 608b 0a13 60ac 2391 56ea 001a 527e  ..`...`.#.V...R~
        0x0030:  3e31 2000 0000 0000 0000 0000 0000 df31  >1.............1
        0x0040:  2000                                     ..
14:48:05.393481 wlan0 Out IP archlinux.22250 > Nintendo\032Wii\032U.lan.xadmin: UDP, length 17
        0x0000:  0800 0000 0000 0003 0001 0406 f4a4 759b  ..............u.
        0x0010:  ccd3 0000 4500 002d ef19 4000 4011 764a  ....E..-..@.@.vJ
        0x0020:  0a13 60ab 0a13 608b 56ea 2391 0019 d586  ..`...`.V.#.....
        0x0030:  313e 4800 0000 0000 0000 1eea 7adf 0000  1>H.........z...
        0x0040:  5a 
```
 dunno why server would be responding with 17 packets instead of 18 though.. cant tell if thats intended behavior or not

**Comment by GuestDreemurr** [comment]
@jonbarrow it does seem to be failing at the parsing level? i do feel like the library lacks quite a bit of telling you what exactly went wrong so might be worth adding that in next release

probably something like:
```
[Packet Parsing] Checksum invalid <and other necessary info goes here i suppose?>
```

**Comment by jonbarrow** [comment]
> finally got a access key

This indicates to me that you have not fully completed the research here, as having the access key is an absolute requirement. I was operating under the assumption that you had this key, since without it there would be no way for the connection to establish since the client would reject the servers packets due to the invalid checksums. Please ensure you have something in a more working state before filing issues, or at least providing all relevant information. The fact that you didn't have the key before does tell me that you may not have the correct key *still* and that that could be why things are breaking

When setup correctly, this library *does* work for Rendez-Vous servers. @DaniElectra has used Rendez-Vous servers in the past to test our changes, and he has successfully created servers for such games. Which is why I'm a bit hesitant to say it's a library issue at the moment, for all we know it could be something like this specific game made game-specific changes to the protocols (such as WATCH_DOGS, which has it's own RMC message structure and changes the checksum algorithm to something custom)

> (enhanced checksum seems to break something that causes server to silently reject any requests)

This doesn't really tell me anything, tbh, and regardless you NEED to have the enhanced here. The packets from the client use the enhanced checksum. The client is clearly configured to use that mode. Disabling it will never work, the client cannot handle packets using the other mode

> it does seem to be failing at the parsing level?

You have not provided any errors. That indicates to me that it is passing at the parsing level. Which is also backed up by my own testing, where I manually passed one of your sample packets to the library. It parsed it just fine, only throwing an error due to the invalid checksum because I don't have the access key:

```go
package main

import (
	"encoding/hex"
	"fmt"

	"github.com/PretendoNetwork/nex-go/v2"
)

func main() {
	server := nex.NewPRUDPServer()
	server.PRUDPV0Settings.IsQuazalMode = true
	server.PRUDPV0Settings.UseEnhancedChecksum = true

	data, _ := hex.DecodeString("3f31200000000000000000000000e0312000")
	stream := nex.NewByteStreamIn(data, server.LibraryVersions, server.ByteStreamSettings)
	packet, err := nex.NewPRUDPPacketV0(server, nil, stream)

	// * nil because of the checksum, but if you remove that check you get
	// * &{PRUDPPacket:{server:0x140000c6000 sender:<nil> readStream:0x1400000e0c0 version:0 sourceVirtualPort:63 destinationVirtualPort:49 packetType:0 flags:4 sessionID:0 substreamID:0 signature:[0 0 0 0] sequenceID:0 connectionSignature:[0 0 0 0] fragmentID:0 payload:[] message:<nil> sendCount:0 sentAt:{wall:0 ext:0 loc:<nil>} timeout:<nil>}}
	// * Which is a perfectly valid PRUDPv0 packet
	fmt.Printf("%+v\n", packet)
	fmt.Println(err) // * Failed to decode PRUDPv0 packet. Invalid PRUDPv0 checksum
}
```

This packet parses just fine. If I had the access key I could verify the checksum algorithm is working too, but since the checksum is the last section of the packet it means it was able to parse basically the whole packet without issue. What is the access key you said you found?

> i do feel like the library lacks quite a bit of telling you what exactly went wrong so might be worth adding that in next release
> 
> probably something like:
> 
> ```
> [Packet Parsing] Checksum invalid <and other necessary info goes here i suppose?>
> ```

The library already does this, it tells you what goes wrong and where if the error message is logged. In fact, the library currently does return an "invalid checksum" error almost identical to the one you suggested here

<img width="413" height="51" alt="Image" src="https://github.com/user-attachments/assets/948dba7c-b3ab-4b18-ae72-9c476903950f" />

It would be helpful if you could use more isolated snippets to test certain things, like packet parsing, similar to what I've shown in this reply, to try and help narrow things down. Because so far there isn't really a lot to go off of here besides "it doesn't work", and Dani *has* gotten Rendez-Vous games online with custom servers using this library before when configured correctly

To be clear, I'm not outright rejecting the report, since it is entirely possible there is still some issue here, but there isn't a lot to go off of here at the moment

**Comment by GuestDreemurr** [comment]
did try out that code and i do see the same results as you, but my issue here is that even with my access key (04999fff) it still fails to decode unless i disable enhanced checksum.. in which case i see the output as described

so it is still having that strange behavior weirdly

i also attempted to bruteforce the packet in that script and the access key given by access-key-extractor (01999fff) has the same behavior so it is probably some WATCH_DOGS-like situation? i have looked over the program in ghidra alot and have seen a function that quite literally pulls a access key out of empty memory so it could be generating them for each packet or something else? im not sure as i could not for the life of me find any function that mentioned access key generation or anything of the sort.

will update this to report my findings as i investigate further.

EDIT: said function is seemingly just a regular rdv function? "SetSandboxAccessKey"

**Comment by DaniElectra** [comment]
The fact that the server is sending packets when disabling enhanced checksum is definitely weird, that shouldn't be happening unless by some weird luck when parsing the packet with a 1-byte checksum you get the correct checksum.

It's true that the server currently doesn't log the packet parsing properly and instead it gets ignored, which explains this confusion: https://github.com/PretendoNetwork/nex-go/blob/77b872cb5889cd5b7c57b36c81a028944a9b67fe/prudp_server.go#L240

**Comment by jonbarrow** [comment]
> It's true that the server currently doesn't log the packet parsing properly and instead it gets ignored, which explains this confusion: https://github.com/PretendoNetwork/nex-go/blob/77b872cb5889cd5b7c57b36c81a028944a9b67fe/prudp_server.go#L240

Ah right, I did forget about this. The reason it's ignored here is because this is the method that handles trying to parse the message from the socket. Which means it's very likely to get bad data just naturally (random spam, stale clients resending bad packets, etc.) and so logging errors there would be extremely noisy and unhelpful in most cases

We can add a flag or something to enable this though for debugging purposes

**Comment by GuestDreemurr** [comment]
> The fact that the server is sending packets when disabling enhanced checksum is definitely weird, that shouldn't be happening unless by some weird luck when parsing the packet with a 1-byte checksum you get the correct checksum.


that looks like it to me, have no other clue what would cause this behavior honestly because i have not found anything in uplay's executable that alludes to it modifying any core Rendez-Vous functions.

**Comment by GuestDreemurr** [comment]
access key was "Uplay123" does treat ACK packets like it doesn't get them though but it does work with enhanced checksum now (#dev-guest on the discord has more information then im willing to type here lol)

**Comment by GuestDreemurr** [comment]
only actual nex-go side issue was fixed in commit 6136f2d
